{
  "schemaVersion": "1",
  "requestId": "req_01J5ABCDEFGHJKMNPQRSTVWXY2",
  "decisionId": "dec_01J5ABCDEFGHJKMNPQRSTVWXY3",
  "correlationId": "corr_01J5ABCDEFGHJKMNPQRSTVWXY2",
  "outcome": "approval_required",
  "reasonCode": "delegation_required",
  "displayReason": "Approval is required for this action.",
  "clientScopeHash": "sha256:3132ebd5be07ede2434709e2e1b354ff3ed71e0ee88c2e8f890b9e8f398dc7ae",
  "authoritativeScopeHash": "sha256:2beccecb8ab7aa14afacf117fe81869dd275c1319a6add5ea8b2de90088c681c",
  "policyRevision": "policy_42",
  "serverTime": "2026-07-25T20:02:01Z",
  "expiresAt": "2026-07-25T20:07:01Z",
  "approval": {
    "approvalId": "apr_01J5ABCDEFGHJKMNPQRSTVWXY2",
    "status": "pending",
    "expiresAt": "2026-07-25T20:17:01Z"
  },
  "auditRef": "audit_01J5ABCDEFGHJKMNPQRSTVWXY3",
  "cache": {
    "cacheable": false
  }
}
