{
  "schemaVersion": "1",
  "requestId": "req_01J5ABCDEFGHJKMNPQRSTVWXY0",
  "decisionId": "dec_01J5ABCDEFGHJKMNPQRSTVWXY2",
  "correlationId": "corr_01J5ABCDEFGHJKMNPQRSTVWXY0",
  "outcome": "deny",
  "reasonCode": "missing_identity",
  "displayReason": "Authenticated identity is required.",
  "clientScopeHash": "sha256:eeeeeeeeeeeeeeeeeeeeeeeeeeeeeeeeeeeeeeeeeeeeeeeeeeeeeeeeeeeeeeee",
  "authoritativeScopeHash": "sha256:ffffffffffffffffffffffffffffffffffffffffffffffffffffffffffffffff",
  "policyRevision": "policy_42",
  "serverTime": "2026-07-25T20:02:01Z",
  "expiresAt": "2026-07-25T20:03:01Z",
  "auditRef": "audit_01J5ABCDEFGHJKMNPQRSTVWXY2",
  "cache": {
    "cacheable": false
  }
}
