{
  "schemaVersion": "1",
  "requestId": "req_01J5ABCDEFGHJKMNPQRSTVWXY0",
  "decisionId": "dec_01J5ABCDEFGHJKMNPQRSTVWXY0",
  "correlationId": "corr_01J5ABCDEFGHJKMNPQRSTVWXY0",
  "outcome": "allow",
  "reasonCode": "policy_allowed",
  "displayReason": "The action is authorized.",
  "clientScopeHash": "sha256:aaaaaaaaaaaaaaaaaaaaaaaaaaaaaaaaaaaaaaaaaaaaaaaaaaaaaaaaaaaaaaaa",
  "authoritativeScopeHash": "sha256:bbbbbbbbbbbbbbbbbbbbbbbbbbbbbbbbbbbbbbbbbbbbbbbbbbbbbbbbbbbbbbbb",
  "policyRevision": "policy_42",
  "serverTime": "2026-07-25T20:00:01Z",
  "expiresAt": "2026-07-25T20:05:00Z",
  "auditRef": "audit_01J5ABCDEFGHJKMNPQRSTVWXY0",
  "cache": {
    "cacheable": false
  }
}
